{
  "build_id": "packbuild:pack:palier1:be:birds:run003-v11-baseline:1:v2:3d45ebad",
  "built_at": "2026-05-02T16:13:23.024496Z",
  "distractor_count": 3,
  "pack_compiled_version": "pack.compiled.v2",
  "pack_id": "pack:palier1:be:birds:run003-v11-baseline",
  "question_count_built": 50,
  "question_count_requested": 50,
  "questions": [
    {
      "options": [
        {
          "canonical_taxon_id": "taxon:birds:000014",
          "is_correct": true,
          "option_id": "q1:opt:target",
          "playable_item_id": "playable:qr:media:inaturalist:106685027",
          "reason_codes": [],
          "referenced_only": false,
          "score": 1.0,
          "source": "playable_corpus.v1",
          "taxon_label": "Eurasian Blackbird"
        },
        {
          "canonical_taxon_id": "taxon:birds:000002",
          "is_correct": false,
          "option_id": "q1:opt:d1",
          "playable_item_id": "playable:qr:media:inaturalist:179697316",
          "reason_codes": [
            "diversity_fallback"
          ],
          "referenced_only": false,
          "score": 0.1,
          "source": "playable_corpus.v1",
          "taxon_label": "Carrion Crow"
        },
        {
          "canonical_taxon_id": "taxon:birds:000005",
          "is_correct": false,
          "option_id": "q1:opt:d2",
          "playable_item_id": "playable:qr:media:inaturalist:30812264",
          "reason_codes": [
            "diversity_fallback"
          ],
          "referenced_only": false,
          "score": 0.1,
          "source": "playable_corpus.v1",
          "taxon_label": "Common Chaffinch"
        },
        {
          "canonical_taxon_id": "taxon:birds:000007",
          "is_correct": false,
          "option_id": "q1:opt:d3",
          "playable_item_id": "playable:qr:media:inaturalist:14878944",
          "reason_codes": [
            "diversity_fallback"
          ],
          "referenced_only": false,
          "score": 0.1,
          "source": "playable_corpus.v1",
          "taxon_label": "White Wagtail"
        }
      ],
      "position": 1,
      "target_canonical_taxon_id": "taxon:birds:000014",
      "target_playable_item_id": "playable:qr:media:inaturalist:106685027"
    },
    {
      "options": [
        {
          "canonical_taxon_id": "taxon:birds:000004",
          "is_correct": true,
          "option_id": "q2:opt:target",
          "playable_item_id": "playable:qr:media:inaturalist:108990173",
          "reason_codes": [],
          "referenced_only": false,
          "score": 1.0,
          "source": "playable_corpus.v1",
          "taxon_label": "European Robin"
        },
        {
          "canonical_taxon_id": "taxon:birds:000009",
          "is_correct": false,
          "option_id": "q2:opt:d1",
          "playable_item_id": "playable:qr:media:inaturalist:128796357",
          "reason_codes": [
            "diversity_fallback"
          ],
          "referenced_only": false,
          "score": 0.1,
          "source": "playable_corpus.v1",
          "taxon_label": "House Sparrow"
        },
        {
          "canonical_taxon_id": "taxon:birds:000012",
          "is_correct": false,
          "option_id": "q2:opt:d2",
          "playable_item_id": "playable:qr:media:inaturalist:92947678",
          "reason_codes": [
            "diversity_fallback"
          ],
          "referenced_only": false,
          "score": 0.1,
          "source": "playable_corpus.v1",
          "taxon_label": "Eurasian Blackcap"
        },
        {
          "canonical_taxon_id": "taxon:birds:000015",
          "is_correct": false,
          "option_id": "q2:opt:d3",
          "playable_item_id": "playable:qr:media:inaturalist:205550561",
          "reason_codes": [
            "diversity_fallback"
          ],
          "referenced_only": false,
          "score": 0.1,
          "source": "playable_corpus.v1",
          "taxon_label": "Song Thrush"
        }
      ],
      "position": 2,
      "target_canonical_taxon_id": "taxon:birds:000004",
      "target_playable_item_id": "playable:qr:media:inaturalist:108990173"
    },
    {
      "options": [
        {
          "canonical_taxon_id": "taxon:birds:000009",
          "is_correct": true,
          "option_id": "q3:opt:target",
          "playable_item_id": "playable:qr:media:inaturalist:113198384",
          "reason_codes": [],
          "referenced_only": false,
          "score": 1.0,
          "source": "playable_corpus.v1",
          "taxon_label": "House Sparrow"
        },
        {
          "canonical_taxon_id": "taxon:birds:000018",
          "is_correct": false,
          "option_id": "q3:opt:d1",
          "playable_item_id": "playable:qr:media:inaturalist:138601109",
          "reason_codes": [
            "diversity_fallback"
          ],
          "referenced_only": false,
          "score": 0.1,
          "source": "playable_corpus.v1",
          "taxon_label": "Common Reed Warbler"
        },
        {
          "canonical_taxon_id": "taxon:birds:000020",
          "is_correct": false,
          "option_id": "q3:opt:d2",
          "playable_item_id": "playable:qr:media:inaturalist:143807565",
          "reason_codes": [
            "diversity_fallback"
          ],
          "referenced_only": false,
          "score": 0.1,
          "source": "playable_corpus.v1",
          "taxon_label": "Black Redstart"
        },
        {
          "canonical_taxon_id": "taxon:birds:000021",
          "is_correct": false,
          "option_id": "q3:opt:d3",
          "playable_item_id": "playable:qr:media:inaturalist:122963324",
          "reason_codes": [
            "diversity_fallback"
          ],
          "referenced_only": false,
          "score": 0.1,
          "source": "playable_corpus.v1",
          "taxon_label": "Mallard"
        }
      ],
      "position": 3,
      "target_canonical_taxon_id": "taxon:birds:000009",
      "target_playable_item_id": "playable:qr:media:inaturalist:113198384"
    },
    {
      "options": [
        {
          "canonical_taxon_id": "taxon:birds:000003",
          "is_correct": true,
          "option_id": "q4:opt:target",
          "playable_item_id": "playable:qr:media:inaturalist:11889278",
          "reason_codes": [],
          "referenced_only": false,
          "score": 1.0,
          "source": "playable_corpus.v1",
          "taxon_label": "Eurasian Blue Tit"
        },
        {
          "canonical_taxon_id": "taxon:birds:000022",
          "is_correct": false,
          "option_id": "q4:opt:d1",
          "playable_item_id": "playable:qr:media:inaturalist:106553706",
          "reason_codes": [
            "diversity_fallback"
          ],
          "referenced_only": false,
          "score": 0.1,
          "source": "playable_corpus.v1",
          "taxon_label": "Greylag Goose"
        },
        {
          "canonical_taxon_id": "taxon:birds:000024",
          "is_correct": false,
          "option_id": "q4:opt:d2",
          "playable_item_id": "playable:qr:media:inaturalist:13370671",
          "reason_codes": [
            "diversity_fallback"
          ],
          "referenced_only": false,
          "score": 0.1,
          "source": "playable_corpus.v1",
          "taxon_label": "Eurasian Coot"
        },
        {
          "canonical_taxon_id": "taxon:birds:000026",
          "is_correct": false,
          "option_id": "q4:opt:d3",
          "playable_item_id": "playable:qr:media:inaturalist:123601681",
          "reason_codes": [
            "diversity_fallback"
          ],
          "referenced_only": false,
          "score": 0.1,
          "source": "playable_corpus.v1",
          "taxon_label": "Yellow-legged Gull"
        }
      ],
      "position": 4,
      "target_canonical_taxon_id": "taxon:birds:000003",
      "target_playable_item_id": "playable:qr:media:inaturalist:11889278"
    },
    {
      "options": [
        {
          "canonical_taxon_id": "taxon:birds:000008",
          "is_correct": true,
          "option_id": "q5:opt:target",
          "playable_item_id": "playable:qr:media:inaturalist:108990786",
          "reason_codes": [],
          "referenced_only": false,
          "score": 1.0,
          "source": "playable_corpus.v1",
          "taxon_label": "Great Tit"
        },
        {
          "canonical_taxon_id": "taxon:birds:000027",
          "is_correct": false,
          "option_id": "q5:opt:d1",
          "playable_item_id": "playable:qr:media:inaturalist:150126557",
          "reason_codes": [
            "diversity_fallback"
          ],
          "referenced_only": false,
          "score": 0.1,
          "source": "playable_corpus.v1",
          "taxon_label": "European Herring Gull"
        },
        {
          "canonical_taxon_id": "taxon:birds:000028",
          "is_correct": false,
          "option_id": "q5:opt:d2",
          "playable_item_id": "playable:qr:media:inaturalist:350879955",
          "reason_codes": [
            "diversity_fallback"
          ],
          "referenced_only": false,
          "score": 0.1,
          "source": "playable_corpus.v1",
          "taxon_label": "Great Cormorant"
        },
        {
          "canonical_taxon_id": "taxon:birds:000030",
          "is_correct": false,
          "option_id": "q5:opt:d3",
          "playable_item_id": "playable:qr:media:inaturalist:551776775",
          "reason_codes": [
            "diversity_fallback"
          ],
          "referenced_only": false,
          "score": 0.1,
          "source": "playable_corpus.v1",
          "taxon_label": "Little Egret"
        }
      ],
      "position": 5,
      "target_canonical_taxon_id": "taxon:birds:000008",
      "target_playable_item_id": "playable:qr:media:inaturalist:108990786"
    },
    {
      "options": [
        {
          "canonical_taxon_id": "taxon:birds:000010",
          "is_correct": true,
          "option_id": "q6:opt:target",
          "playable_item_id": "playable:qr:media:inaturalist:108293198",